patent_num,abstract,applicant_city,applicant_country,applicant_name,applicant_num,applicant_state,assignee_loc,assignee_name,family_id,file_date,inventors,patent_date,title,url
"10,341,692","A system for delivering audio and video to one or more users comprising a video/audio receiver, an encoder process/encoder machine operationally associated with the video/audio receiver, an UPLOADer Process/machine operationally associated with the encoder process/encoder machine, a Content Delivery Network (CDN) operationally associated with the UPLOADer Process/machine and one or more client/subscriber machines operationally associated with the CDN.",Boone,US,Cardona; Diego,"15/604,768",NC,,,1000004121282,"May 25, 2017","[['Diego', 'Cardona', 'Boone, NC']]","July 2, 2019","Live streaming-TV content, acquisition, transformation, encryption, and distribution system, and method for its use",http://patft.uspto.gov/netacgi/nph-Parser?Sect1=PTO2&Sect2=HITOFF&u=%2Fnetahtml%2FPTO%2Fsearch-adv.htm&r=48&p=1&f=G&l=50&d=PTXT&S1=google&OS=google&RS=google
"10,341,687",A method and system disclosed assigns first videos to hardware decoders having a first configuration. The hardware decoders in the first configuration are to decode the first videos for concurrent presentation on a display of a user device. The method and system receives an indication that second videos are to be presented on the display of the user device. The method and system determine a second configuration of the hardware decoders based on an estimated penalty for the second configuration. The method and system assigns the second videos to the hardware decoders for decoding according to the second configuration.,Mountain View,US,Google LLC,"15/948,152",CA,"Mountain View, CA",Google LLC,1000003288842,"April 9, 2018","[['Ryan James', 'Lothian', 'Cambridge, MA'], ['Liam Thomas', 'Barden', 'London, GB']]","July 2, 2019",Assigning videos to single-stream and multi-stream decoders,http://patft.uspto.gov/netacgi/nph-Parser?Sect1=PTO2&Sect2=HITOFF&u=%2Fnetahtml%2FPTO%2Fsearch-adv.htm&r=49&p=1&f=G&l=50&d=PTXT&S1=google&OS=google&RS=google
"10,341,686","The present invention concerns a method for dynamically adapting the lossy encoding of an audio and/or video stream (112) transmitted by a first device (101) to a remote device (102), said method comprising the following steps: the remote device (102) receives and decodes said stream (112), called the incoming stream, and transmits an outgoing stream (111) having at least one indicator relating to a state of said remote device (102) that is modified by the execution of the decoding of the incoming stream (112); the first device (101) receives the outgoing stream (111), extracts said at least one indicator therefrom and adapts the encoding of the incoming stream (112) according to said at least one extracted indicator. The method can be applied notably to video conferences conducted on the basis of self-powered terminals for the purpose of maintaining the operating period of these terminals.",San Jose,US,"Harmonic, Inc.","14/651,772",CA,"San Jose, CA","Harmonic, Inc.",1000004121278,"December 12, 2013","[['Xavier', 'Ducloux', 'Rennes, FR']]","July 2, 2019",Method for dynamically adapting the encoding of an audio and/or video stream transmitted to a device,http://patft.uspto.gov/netacgi/nph-Parser?Sect1=PTO2&Sect2=HITOFF&u=%2Fnetahtml%2FPTO%2Fsearch-adv.htm&r=50&p=1&f=G&l=50&d=PTXT&S1=google&OS=google&RS=google
"10,341,641","An electronic device according to various embodiments of the present disclosure includes: a first image sensor; a second image sensor; and a processor operatively coupled to the first image sensor and the image second sensor, configured to determine at least one Region of Interest (ROI) based on a first information acquired using the first image sensor, acquire second information corresponding to at least a part of the at least one ROI using the second image sensor, identify a motion related to the at least one ROI based on the second information, and perform a function corresponding to the motion.",Gyeonggi-do,KR,"Samsung Electronics Co., Ltd","15/273,570",N/A,"Suwon-si, KR","Samsung Electronics Co., Ltd.",1000004121236,"September 22, 2016","[['Yongchan', 'Keh', 'Seoul, KR'], ['Sungsoon', 'Kim', 'Seoul, KR'], ['Jungkee', 'Lee', 'Gyeonggi-do, KR'], ['Byeonghoon', 'Park', 'Gyeonggi-do, KR'], ['Kisuk', 'Sung', 'Gyeonggi-do, KR']]","July 2, 2019",Method for performing image process and electronic device thereof,http://patft.uspto.gov/netacgi/nph-Parser?Sect1=PTO2&Sect2=HITOFF&u=%2Fnetahtml%2FPTO%2Fsearch-adv.htm&r=51&f=G&l=50&d=PTXT&s1=google&p=2&OS=google&RS=google
"10,341,632","An environment may be displayed from a viewpoint. According to one method, volumetric video data may be acquired depicting the environment, for example, using a tiled camera array. A plurality of vantages may be distributed throughout a viewing volume from which the environment is to be viewed. The volumetric video data may be used to generate video data for each vantage, representing the view of the environment from that vantage. User input may be received designating a viewpoint within the viewing volume. From among the plurality of vantages, a subset nearest to the viewpoint may be identified. The video data from the subset may be retrieved and combined to generate viewpoint video data depicting the environment from the viewpoint. The viewpoint video data may be displayed for the viewer to display a view of the environment from the viewpoint selected by the user.",Mountain View,US,Google LLC.,"15/590,877",CA,,,1000004121228,"May 9, 2017","[['Derek', 'Pang', 'San Jose, CA'], ['Colvin', 'Pitts', 'Snohomish, WA'], ['Kurt', 'Akeley', 'Saratoga, CA']]","July 2, 2019",Spatial random access enabled video system with a three-dimensional viewing volume,http://patft.uspto.gov/netacgi/nph-Parser?Sect1=PTO2&Sect2=HITOFF&u=%2Fnetahtml%2FPTO%2Fsearch-adv.htm&r=52&f=G&l=50&d=PTXT&s1=google&p=2&OS=google&RS=google
"10,341,628","This document describes techniques and apparatuses for implementing monochrome-color mapping using a monochromatic imager and a color map sensor. These techniques and apparatuses enable better resolution, depth of color, or low-light sensitivity than many conventional sensor arrays.",Mountain View,US,Google Inc.,"15/439,882",CA,"Mountain View, CA",Google LLC,1000004121224,"February 22, 2017","[['Philip Sean', 'Stetson', 'Wexford, PA']]","July 2, 2019",Monochrome-color mapping using a monochromatic imager and a color map sensor,http://patft.uspto.gov/netacgi/nph-Parser?Sect1=PTO2&Sect2=HITOFF&u=%2Fnetahtml%2FPTO%2Fsearch-adv.htm&r=53&f=G&l=50&d=PTXT&s1=google&p=2&OS=google&RS=google
"10,341,621","Full-color images of low-light scenes are generated by the systems and methods described herein using only two light channels. An array of photosensitive pixels includes two sets of pixels, the first sensitive only to light associated with a first light channel, the second only to light associated with a second light channel. Thus the first set of pixels generate a first set of electrical signals in response to incident light within the first light channel, and the second set of pixels generate a second set of electrical signals in response to incident light within the second light channel. An image processor receives the first and second sets of electrical signals and generates a full-color image of the scene by processing only signals generated by the first and second sets of pixels.",Beverly,US,"Chromatra, LLC.","15/920,214",MA,"Beverly, MA","Chromatra, LLC.",1000004121217,"March 13, 2018","[['Peter W. J.', 'Jones', 'Belmont, MA'], ['Ellen', 'Cargill', 'Norfolk, MA'], ['Dennis W.', 'Purcell', 'Medford, MA']]","July 2, 2019",Systems and methods for creating full-color image in low light,http://patft.uspto.gov/netacgi/nph-Parser?Sect1=PTO2&Sect2=HITOFF&u=%2Fnetahtml%2FPTO%2Fsearch-adv.htm&r=54&f=G&l=50&d=PTXT&s1=google&p=2&OS=google&RS=google
"10,341,617","A system for determining a travel path, including a network of at least one camera, a communication hub coupled to the network of at least one camera, at least one electronic communication device, and a data processing system coupled to the communication hub, the data processing system comprising one or more processors configured to calculate a travel path based on user-specified criteria including maximum camera coverage, where the system is adapted to dynamically identify a plurality of cameras.",West Lafayette,US,Purdue Research Foundation,"15/468,101",IN,"West Lafayette, IN",Purdue Research Foundation,1000004121213,"March 23, 2017","[['Abish', 'Malik', 'Northridge, CA'], ['David Scott', 'Ebert', 'West Lafayette, IN'], ['Hanye', 'Xu', 'West Lafayette, IN'], ['James', 'Tay', 'West Lafayette, IN'], ['Shehzad', 'Afzal', 'West Lafayette, IN'], ['Yung-hsiang', 'Lu', 'West Lafayette, IN']]","July 2, 2019",Public safety camera identification and monitoring system and method,http://patft.uspto.gov/netacgi/nph-Parser?Sect1=PTO2&Sect2=HITOFF&u=%2Fnetahtml%2FPTO%2Fsearch-adv.htm&r=55&f=G&l=50&d=PTXT&s1=google&p=2&OS=google&RS=google
"10,341,579","Embodiments are disclosed of an apparatus including a first digital camera with an image sensor optically coupled to a first lens, the first lens having a first magnification and a second digital camera including an image sensor optically coupled to a second lens. The second lens the second lens has a magnification that is greater than the magnification of the first lens and the second lens is a non-rectilinear lens having a magnification gradient in which magnification is highest at the center of the second lens and lowest at the edges. Other embodiments are disclosed and claimed.",Mountain View,US,GOOGLE LLC,"16/053,273",CA,"Mountain View, CA",Google LLC,1000004121179,"August 2, 2018","[['Li-Ping', 'Wang', 'Mountain View, CA']]","July 2, 2019",Camera system including lens with magnification gradient,http://patft.uspto.gov/netacgi/nph-Parser?Sect1=PTO2&Sect2=HITOFF&u=%2Fnetahtml%2FPTO%2Fsearch-adv.htm&r=56&f=G&l=50&d=PTXT&s1=google&p=2&OS=google&RS=google
"10,341,560","A method is executed at a camera for controlling a camera mode. The camera is operated in a night mode in which an IR filter is not interposed between a lens assembly and a sensor array of the camera. While operating in the night mode, the camera receives at the sensor array ambient light that is not filtered by the IR filter, and determines whether the received ambient light is due to a light source other than an IR light source. The camera continues operation of the camera in the night mode when it is determined that the received ambient light is due to an IR light source. In some implementations, the camera switches the operation of the camera from the night mode to a day mode when it is determined the received ambient light is due to a light source other than an IR light source.",Mountain View,US,GOOGLE LLC,"15/785,151",CA,"Mountain View, CA",GOOGLE LLC,1000004121166,"October 16, 2017","[['Bill', 'Duran', 'Santa Cruz, CA'], ['Adrian Mircea', 'Proca', 'Santa Cruz, CA']]","July 2, 2019",Camera mode switching based on light source determination,http://patft.uspto.gov/netacgi/nph-Parser?Sect1=PTO2&Sect2=HITOFF&u=%2Fnetahtml%2FPTO%2Fsearch-adv.htm&r=57&f=G&l=50&d=PTXT&s1=google&p=2&OS=google&RS=google
"10,341,559","A multicamera panoramic imaging system having no parallax. In an example, the multicamera panoramic imaging system includes multiple discrete, imaging systems disposed in a side-by-side array, wherein a field of view of each discrete, imaging systems is conjoined with a field of view of each adjacent discrete imaging system, further wherein a stencil of chief rays at the edge of the field of view of any one of the discrete imaging systems will be substantially parallel to a stencil of chief rays at the edge of the field of view of any adjacent ones of the discrete imaging systems such that all of the substantially parallel stencils of chief rays appear to converge to a common point when viewed from object space. A method for forming an image of an object having no parallax.",Long Island City,US,Niazi; Zakariya,"15/309,180",NY,,,1000004121165,"May 5, 2015","[['Zakariya', 'Niazi', 'Long Island City, NY']]","July 2, 2019","Imaging system, method, and applications",http://patft.uspto.gov/netacgi/nph-Parser?Sect1=PTO2&Sect2=HITOFF&u=%2Fnetahtml%2FPTO%2Fsearch-adv.htm&r=58&f=G&l=50&d=PTXT&s1=google&p=2&OS=google&RS=google
"10,341,554","A portable communication device is provided for generating a panorama image. The portable communication device includes a touchscreen display; a fingerprint sensor; an image sensor; and a processor adapted to display, via the touchscreen display, a preview image obtained via the image sensor; receive, via the fingerprint sensor, a user input while the preview image is presented; and in response to the user input, generate a panorama image using the image sensor.",Gyeonggi-do,KR,"Samsung Electronics Co., Ltd.","16/033,906",N/A,KR,"Samsung Electronics Co., Ltd",1000004121160,"July 12, 2018","[['Namjin', 'Kim', 'Gyeonggi-do, KR'], ['Sora', 'Hyun', 'Gyeonggi-do, KR'], ['Hyunho', 'Seo', 'Gyeonggi-do, KR'], ['Changhyun', 'Chun', 'Gyeonggi-do, KR'], ['Yunemo', 'Koo', 'Gyeonggi-do, KR'], ['Gaeyoun', 'Kim', 'Gyeonggi-do, KR'], ['Geonsoo', 'Kim', 'Gyeonggi-do, KR'], ['Heedeog', 'Kim', 'Gyeonggi-do, KR'], ['Sunghyuk', 'Shin', 'Gyeonggi-do, KR'], ['Kihuk', 'Lee', 'Gyeonggi-do, KR'], ['Chulhwan', 'Lee', 'Seoul, KR'], ['Cheolho', 'Cheong', 'Seoul, KR'], ['Seungmin', 'Choi', 'Gyeonggi-do, KR']]","July 2, 2019",Method for control of camera module based on physiological signal,http://patft.uspto.gov/netacgi/nph-Parser?Sect1=PTO2&Sect2=HITOFF&u=%2Fnetahtml%2FPTO%2Fsearch-adv.htm&r=59&f=G&l=50&d=PTXT&s1=google&p=2&OS=google&RS=google
"10,341,478","Presented here is a handheld writing implement form factor for a mobile device. The shape of the device can correspond to the shape of a whiteboard marker. Due to the small size, the device does not have a physical keyboard or an onscreen keyboard and instead relies on environmental cues, gestural input, voice input, and touch input to interpret user instructions. For example, when the device determines from environmental cues that it is resting on a tabletop, a touch input consisting of a single press from the user is interpreted as an instruction to scroll the display. In other embodiments, the device can be used as a handheld writing implement, such as a computer stylus, or to control the device by handwriting in the air. Other uses of the device are disclosed such as making a payment, communicating with other appliances enabled for electronic communication, recording images with a gesture, etc.",Palo Alto,US,"Essential Products, Inc.","15/716,276",CA,"Palo Alto, CA","ESSENTIAL PRODUCTS, INC.",1000004121091,"September 26, 2017","[['Siqi', 'Li', 'Menlo Park, CA'], ['David John', 'Evans, V', 'Palo Alto, CA']]","July 2, 2019",Handheld writing implement form factor mobile device,http://patft.uspto.gov/netacgi/nph-Parser?Sect1=PTO2&Sect2=HITOFF&u=%2Fnetahtml%2FPTO%2Fsearch-adv.htm&r=60&f=G&l=50&d=PTXT&s1=google&p=2&OS=google&RS=google
"10,341,459",An approach includes a system implemented in a computer infrastructure including a processor. The approach further includes the processor configured to receive dimensionally aware linkages. The approach further includes the processor configured to retrieve aggregated data from a data set. The approach further includes the processor configured to identify at least one affinity cluster related to the dimensionally aware linkages in at least two dimensions and the retrieved aggregated data by performing at least one lookup linkage which matches at least one dimension of the at least two dimensions of the dimensionally aware linkages with the retrieved aggregated data. The approach further includes the processor configured to provide personalized content to a user having same or similar user preferences as the received dimensionally aware linkages based on the identified at least one affinity cluster.,Armonk,US,INTERNATIONAL BUSINESS MACHINES CORPORATION,"14/858,407",NY,"Armonk, NY",INTERNATIONAL BUSINESS MACHINES CORPORATION,1000004121073,"September 18, 2015","[['Faried', 'Abrahams', 'Laytonsville, MD'], ['Amol A.', 'Dhondse', 'Pune, IN'], ['Kerrie L.', 'Holley', 'Montara, CA'], ['Anand', 'Pikle', 'Pune, IN'], ['Gandhi', 'Sivakumar', 'Melbourne, AU'], ['Lennox E.', 'Thomas', 'Decatur, GA']]","July 2, 2019",Personalized content and services based on profile information,http://patft.uspto.gov/netacgi/nph-Parser?Sect1=PTO2&Sect2=HITOFF&u=%2Fnetahtml%2FPTO%2Fsearch-adv.htm&r=61&f=G&l=50&d=PTXT&s1=google&p=2&OS=google&RS=google
"10,341,457","This document describes a content caching system for pre-loading digital components, the system including a communication interface configured to communicate with a remote device over a wireless network, a local content cache; and an evaluation system comprising one or more processors. The one or more operations include pre-loading a digital component for rendering in a browser at a time that is subsequent to a time of the pre-loading, registering a scheme of a network reference for the cached digital component, with the scheme comprising a specified portion of the network reference for the cached digital component; retrieving, from the local content cache, the pre-loaded digital component associated with the digital component tag comprising the network reference; and rendering, from the local content cache, the pre-loaded digital component in a graphical user interface rather than requesting the digital component from the remote device.",Mountain View,US,Google LLC,"16/154,862",CA,"Mountain View, CA",Google LLC,1000004121071,"October 9, 2018","[['Tuna', 'Toksoz', 'Mountain View, CA'], ['Thomas Graham', 'Price', 'San Francisco, CA'], ['Anurag', 'Agrawal', 'Palo Alto, CA']]","July 2, 2019",Caching system,http://patft.uspto.gov/netacgi/nph-Parser?Sect1=PTO2&Sect2=HITOFF&u=%2Fnetahtml%2FPTO%2Fsearch-adv.htm&r=62&f=G&l=50&d=PTXT&s1=google&p=2&OS=google&RS=google
"10,341,447",Systems and methods are disclosed herein to provide information to a user based on a symbol with a plurality of interpretations. Each candidate interpretation for the symbol is identified and compared to an attribute of a user profile. The meaning of the symbol is determined and the user profile is updated with the meaning of the symbol. This meaning may be used to provide relevant information to the user.,San Jose,US,"Rovi Guides, Inc.","15/852,915",CA,"San jose, CA","ROVI GUIDES, INC.",1000004121061,"December 22, 2017","[['Timothy Christensen', 'Kelly', 'Austin, TX'], ['Benjamin', 'Maughan', 'Pleasanton, CA'], ['Brian', 'Peterson', 'Barrington, IL'], ['David', 'Yon', 'Studio City, CA'], ['Walter R.', 'Klappert', 'Los Angeles, CA']]","July 2, 2019",Systems and methods for resolving ambiguous terms in social chatter based on a user profile,http://patft.uspto.gov/netacgi/nph-Parser?Sect1=PTO2&Sect2=HITOFF&u=%2Fnetahtml%2FPTO%2Fsearch-adv.htm&r=63&f=G&l=50&d=PTXT&s1=google&p=2&OS=google&RS=google
"10,341,436","Systems and methods are described to transfer content from a first computing device to a second computing that is not directly accessible from the first computing device. The transfer may be carried out using an application operating on the first computing device that uploads the content to the cloud storage service. The second computing device may operate an application that monitors the cloud storage service for recently uploaded content. When the second computing device detects that content has been uploaded to the cloud storage service, the second computing device may download the content. The second computing device may update a manifest file located on the cloud storage service to indicate that the content was downloaded. Subsequently, the first computing device may access the manifest file and determine that content was downloaded.",Round Rock,US,Dell Products L.P.,"15/265,734",TX,"Round Rock, TX",Dell Products L.P.,1000004121052,"September 14, 2016","[['Danilo O.', 'Tan', 'Austin, TX'], ['Abu Shaher', 'Sanaullah', 'Austin, TX'], ['Fernando L.', 'Guerrero', 'Austin, TX']]","July 2, 2019",Using cloud storage as temporary cache for backup,http://patft.uspto.gov/netacgi/nph-Parser?Sect1=PTO2&Sect2=HITOFF&u=%2Fnetahtml%2FPTO%2Fsearch-adv.htm&r=64&f=G&l=50&d=PTXT&s1=google&p=2&OS=google&RS=google
"10,341,430","Systems and methods for graph based artificial intelligence systems for identity management systems are disclosed. Embodiments of the identity management systems disclosed herein may utilize a network graph approach to peer grouping of identities of distributed networked enterprise computing environment. Specifically, in certain embodiments, data on the identities and the respective entitlements assigned to each identity as utilized in an enterprise computer environment may be obtained by an identity management system. A network identity graph may be constructed using the identity and entitlement data. The identity graph can then be clustered into peer groups of identities. The peer groups of identities may be used by the identity management system and users thereof in risk assessment or other identity management tasks.",Wilmington,US,"SailPoint Technologies, Inc.","16/201,604",DE,"Wilmington, DE","SailPoint Technologies, Inc.",1000003854843,"November 27, 2018","[['Mohamed M.', 'Badawy', 'Round Rock, TX'], ['Jostine Fei', 'Ho', 'Austin, TX']]","July 2, 2019","System and method for peer group detection, visualization and analysis in identity management artificial intelligence systems using cluster based analysis of network identity graphs",http://patft.uspto.gov/netacgi/nph-Parser?Sect1=PTO2&Sect2=HITOFF&u=%2Fnetahtml%2FPTO%2Fsearch-adv.htm&r=65&f=G&l=50&d=PTXT&s1=google&p=2&OS=google&RS=google
"10,341,424","A computer-implemented method of enabling participation by a first client and a second client in a communication session in a multi-dimensional virtual environment, the multi-dimensional virtual environment having first and second avatars respectively associated with the first and second clients and a plurality of objects distinct from the avatars. The method includes receiving from the first client a first annotation associated with a first object of the plurality of objects, transmitting the first annotation to the second client for display at the second client in association with the first object, receiving from the second client a second annotation associated with a second object of the plurality of objects, and transmitting the second annotation to the first client for display at the first client in association with the second object.",Mountain View,US,Google Inc.,"15/203,586",CA,"Mountain View, CA",GOOGLE LLC,1000002225296,"July 6, 2016","[['Alexander', 'Mendes da Costa', 'San Francisco, CA'], ['Niniane', 'Wang', 'Mountain View, CA'], ['Joey Chiu-Wen', 'Liaw', 'San Francisco, CA']]","July 2, 2019",Annotations of objects in multi-dimensional virtual environments,http://patft.uspto.gov/netacgi/nph-Parser?Sect1=PTO2&Sect2=HITOFF&u=%2Fnetahtml%2FPTO%2Fsearch-adv.htm&r=66&f=G&l=50&d=PTXT&s1=google&p=2&OS=google&RS=google
"10,341,421","Social grouping using a device may include determining, by the device, a set of attributes associated with interactions between a user and a set of contacts, wherein the set of attributes associated with the interactions is related to the device. The contacts may be organized into groups. The groups may be hierarchically ordered with at least one of the groups being a subgroup of another one of the groups.",Gyeonggi-Do,KR,"Samsung Electronics Co., Ltd.","14/663,147",N/A,"Gyeonggi-do, KR","SAMSUNG ELECTRONICS CO., LTD.",1000004121040,"March 19, 2015","[['Xuan', 'Bao', 'San Jose, CA'], ['Jun', 'Yang', 'Milpitas, CA'], ['Zhixian', 'Yan', 'Sunnyvale, CA'], ['Lu', 'Luo', 'Sunnyvale, CA'], ['Evan', 'Welbourne', 'Seattle, WA'], ['Yifei', 'Jiang', 'Santa Clara, CA']]","July 2, 2019",On-device social grouping for automated responses,http://patft.uspto.gov/netacgi/nph-Parser?Sect1=PTO2&Sect2=HITOFF&u=%2Fnetahtml%2FPTO%2Fsearch-adv.htm&r=67&f=G&l=50&d=PTXT&s1=google&p=2&OS=google&RS=google
"10,341,419","A method and a file networking system (FNS) transform a content file into a content-centric social network with managed connectivity and indexable touchpoints. The FNS injects a tracking code with widgets for user activities into each portable copy of the content file when user devices request access to the content file before distributing the portable copies to the user devices through a network. The FNS establishes a bidirectional communication with the distributed portable copies (DPCs) through the network to receive tracking information including user created touchpoints identified by the tracking code based on usage of the DPCs. The FNS indexes the touchpoints and creates a satellite internet of users of the DPCs based on invite information and usage of the DPCs. The FNS establishes communication between users of the DPCs in the satellite internet using the widgets through the tracking code and the indexed touchpoints, whereby grouping is automatically achieved.",Chennai,IN,TNQ Books and Journals Private Limited,"15/292,128",N/A,"Chennai, IN",TNQ BOOKS AND JOURNALS PRIVATE LIMITED,1000004121039,"October 13, 2016","[['Venkatesan Sumangali', 'Kidambi', 'Chennai, IN'], ['Bhaskar', 'Mannargudi Venkatraman', 'Chennai, IN'], ['Peroli', 'Sivaprakasam', 'Chennai, IN'], ['Ganesh', 'Natarajan', 'Chennai, IN']]","July 2, 2019",Transformation of a content file into a content-centric social network,http://patft.uspto.gov/netacgi/nph-Parser?Sect1=PTO2&Sect2=HITOFF&u=%2Fnetahtml%2FPTO%2Fsearch-adv.htm&r=68&f=G&l=50&d=PTXT&s1=google&p=2&OS=google&RS=google
