patent_num,abstract,applicant_city,applicant_country,applicant_name,applicant_num,applicant_state,assignee_loc,assignee_name,family_id,file_date,inventors,patent_date,title,url
"10,341,478","Presented here is a handheld writing implement form factor for a mobile device. The shape of the device can correspond to the shape of a whiteboard marker. Due to the small size, the device does not have a physical keyboard or an onscreen keyboard and instead relies on environmental cues, gestural input, voice input, and touch input to interpret user instructions. For example, when the device determines from environmental cues that it is resting on a tabletop, a touch input consisting of a single press from the user is interpreted as an instruction to scroll the display. In other embodiments, the device can be used as a handheld writing implement, such as a computer stylus, or to control the device by handwriting in the air. Other uses of the device are disclosed such as making a payment, communicating with other appliances enabled for electronic communication, recording images with a gesture, etc.",Palo Alto,US,"Essential Products, Inc.","15/716,276",CA,"Palo Alto, CA","ESSENTIAL PRODUCTS, INC.",1000004121091,"September 26, 2017","[['Siqi', 'Li', 'Menlo Park, CA'], ['David John', 'Evans, V', 'Palo Alto, CA']]","July 2, 2019",Handheld writing implement form factor mobile device,http://patft.uspto.gov/netacgi/nph-Parser?Sect1=PTO2&Sect2=HITOFF&u=%2Fnetahtml%2FPTO%2Fsearch-adv.htm&r=1&p=1&f=G&l=50&d=PTXT&S1=paypal&OS=paypal&RS=paypal
"10,339,749","A system and method for parking vehicles using a mobile computing device in which a network of garages and a network of valets are created so that a user can search a given geographical location for a set of parking options including self parking destinations and prices and valet destinations and prices, the user can select an option, upon arrival at the location the user scans an In-App QR code which checks the balance in a user's credit account, the credit account is replenished if necessary, the estimated parking charge is automatically deducted from the user's account and distributed to the garage and the management accounts, and when the user departs the parking location or is picked up by the valet at time desired by the user, the system closes the parking session, calculates the total charges due, deducts the additional charges from the user account and distributes the payment to the garage and the management service provider.",San Francisco,US,"RAPID LANE, LLC","15/392,819",CA,"San Francisco, CA","Rapid Lane, LLC",1000004123742,"December 28, 2016","[['Gritty T.', 'Gebremeskel', 'San Francisco, CA'], ['Binyam', 'Haileselassie', 'San Francisco, CA'], ['Marie', 'Kamali', 'Hercules, CA'], ['Yordanos', 'Merawi', 'San Francisco, CA'], ['Edward C.', 'Singer, Jr.', 'San Francisco, CA'], ['Biruk W.', 'Tadesse', 'Ssan Pablo, CA'], ['Estifanos G.', 'Wolde', 'San Francisco, CA']]","July 2, 2019",System and method for parking vehicles using a mobile computing device,http://patft.uspto.gov/netacgi/nph-Parser?Sect1=PTO2&Sect2=HITOFF&u=%2Fnetahtml%2FPTO%2Fsearch-adv.htm&r=2&p=1&f=G&l=50&d=PTXT&S1=paypal&OS=paypal&RS=paypal
"10,339,580",Software replaces album art stored in metadata of a music file with a personalized picture that is displayed when the music file is played on a music player device. The personalized picture may be selected from diverse sources such as social media sites or hard drives on computers. The personalized music file may be gifted to intended recipients and downloaded to their music player devices. The personalized picture is displayed when the personalized music file is played on the music player device.,Stamford,US,Cohen; Jason,"13/794,495",CT,"Tokyo, JPSONY MUSIC ENTERTAINMENT",SONY CORPORATION,1000004119417,"March 11, 2013","[['Jason', 'Cohen', 'Stamford, CT']]","July 2, 2019",Personalized content generation and delivery,http://patft.uspto.gov/netacgi/nph-Parser?Sect1=PTO2&Sect2=HITOFF&u=%2Fnetahtml%2FPTO%2Fsearch-adv.htm&r=3&p=1&f=G&l=50&d=PTXT&S1=paypal&OS=paypal&RS=paypal
"10,339,558","Methods and systems for managing content related to Sustainable Development Strategies (SDS) may include a processor for receiving content comprising standardized data. The standardized data may include monetary valuations. The processor may be configured to store the received content in a storage device, and communicate with a content publication module and the storage device to publish the SDS content. In an embodiment, the processor may be configured to allow for searching of the published content by criteria based on the standardized SDS content. In an embodiment, the publication of submitted contents may be limited to a first predetermined number. The publication limit may be increased from the first predetermined number to a second predetermined number when a first predetermined threshold is reached. To encourage new quality content, additional increase in the number of contents that may be published may be allowed if additional predetermined thresholds are met.",Clyde Hill,US,Chen; Joyce Chiayu,"14/866,757",WA,,,1000004119399,"September 25, 2015","[['Joyce Chiayu', 'Chen', 'Clyde Hill, WA']]","July 2, 2019","Method and system for integration among content publication, advertisement services and rewards collection",http://patft.uspto.gov/netacgi/nph-Parser?Sect1=PTO2&Sect2=HITOFF&u=%2Fnetahtml%2FPTO%2Fsearch-adv.htm&r=4&p=1&f=G&l=50&d=PTXT&S1=paypal&OS=paypal&RS=paypal
"10,339,540","Methods and systems for coordinating delivery of coupons issued by a network-based system are disclosed. For example, a system can include a coupon generation engine, a coupon widget, and a communications module. The coupon generation engine can issue a unique coupon redeemable exclusively by a registered user of the network-based system. The coupon widget can present the unique coupon via a first communication channel internal to the network-based system. The communications module can deliver the unique coupon to the registered user via a second communication channel external to the network-based system.",PleasantonSan JoseSan Jose,USUSUS,Thordsen; James A.Malik; Raza AliBruck; Scott,"12/610,069",CACACA,"San Jose, CA","PAYPAL, INC.",1000004119383,"October 30, 2009","[['James A.', 'Thordsen', 'Pleasanton, CA'], ['Raza Ali', 'Malik', 'San Jose, CA'], ['Scott', 'Bruck', 'San Jose, CA']]","July 2, 2019",Methods and systems for coordinated coupon delivery,http://patft.uspto.gov/netacgi/nph-Parser?Sect1=PTO2&Sect2=HITOFF&u=%2Fnetahtml%2FPTO%2Fsearch-adv.htm&r=5&p=1&f=G&l=50&d=PTXT&S1=paypal&OS=paypal&RS=paypal
"10,339,525","Exemplary embodiment of the present invention would provide systems, including Internet-based systems, and computer-implemented methods, for providing online Buyers and Sellers who physically transact an exchange of an item at a local meeting place, indicia of confirmation of the exchange on which to base a background online payment. In particular, exemplary embodiments of the present invention would provide a way for Buyers and/or Sellers to input an identifier for online authentication to confirm that a physical exchange of an item sold had been transacted and that would accordingly provide an online system with a basis to charge the relevant Buyer's account for a sale amount and pay the Seller for the item sold. In one exemplary embodiment of the present invention, an NFC-payment-enabled gateway device would be provided that would integrate with a merchant's NFC-enabled POS device to facilitate the merchant's NFC-enabled POS devices to accept mobile payment from devices that are not themselves NFC-enabled.",Pasadena,US,"BOOM! PAYMENTS, INC.","15/195,768",CA,"Pasadena, CA","BOOM! PAYMENTS, INC.",1000004119371,"June 28, 2016","[['Erik T.', 'Bogaard', 'Pasadena, CA']]","July 2, 2019",Confirming local marketplace transaction consummation for online payment consummation,http://patft.uspto.gov/netacgi/nph-Parser?Sect1=PTO2&Sect2=HITOFF&u=%2Fnetahtml%2FPTO%2Fsearch-adv.htm&r=6&p=1&f=G&l=50&d=PTXT&S1=paypal&OS=paypal&RS=paypal
"10,339,524","Systems and methods for multi-merchant tokenization may include receiving a transaction from a point of sale terminal of a merchant, validating the merchant ID against merchant logs, and generating a token for the transaction. The token includes a primary account number, expiration, and a group ID. Additionally, the system provides the primary account number to a payment system and receives a response back. The response is then output back to the merchant along with the token. In subsequent transactions, the system may receive the token from a one point of sale terminal of the merchant. The system validates the merchant ID against merchant logs and ensures the merchant is configured for tokenization. The token is decrypted and the group ID is compared to the merchant ID in the merchant logs. When they match, the primary account number is provided to the payment system for approval.",DurangoDurangoDurango,USUSUS,Plomske; Michelle K.Watts; Charles E.Ozvat; Matthew D.,"13/563,534",COCOCO,"Symmes Township, OH","Worldpay, LLC",1000004119370,"July 31, 2012","[['Michelle K.', 'Plomske', 'Durango, CO'], ['Charles E.', 'Watts', 'Durango, CO'], ['Matthew D.', 'Ozvat', 'Durango, CO']]","July 2, 2019",Systems and methods for multi-merchant tokenization,http://patft.uspto.gov/netacgi/nph-Parser?Sect1=PTO2&Sect2=HITOFF&u=%2Fnetahtml%2FPTO%2Fsearch-adv.htm&r=7&p=1&f=G&l=50&d=PTXT&S1=paypal&OS=paypal&RS=paypal
"10,339,509","A kiosk for accepting a portable electronic device from a client in exchange for payment includes a display, one or more cameras, a portable device receiving arrangement, a payment dispensing arrangement, and a communication connection to a remote server and/or operator. The kiosk is configured to, in conjunction with the remote server and/or operator, control an application program executing on the portable electronic device and one or more the cameras to detect characteristics of the portable electronic device. The kiosk is also configured to determine a value for the portable electronic device based upon aspects including the detected characteristics, and to display the determined value on said at least one display for approval by the client. Subsequently, based upon the determined value, the kiosk provides a payment to the client via the payment dispensing arrangement, and deposits the portable electronic device in the kiosk for subsequent collection.",Montreal,CA,A La Carte Media Inc.,"15/153,137",N/A,"Montreal, Q. C., CA","A La Carte Media, Inc.",1000004119358,"May 12, 2016","[['David', 'Bordeleau', 'Montreal, CA'], ['Tony', 'Mastronardi', 'Montreal, CA']]","July 2, 2019",Systems and methods for remote collection of electronic devices for value,http://patft.uspto.gov/netacgi/nph-Parser?Sect1=PTO2&Sect2=HITOFF&u=%2Fnetahtml%2FPTO%2Fsearch-adv.htm&r=8&p=1&f=G&l=50&d=PTXT&S1=paypal&OS=paypal&RS=paypal
"10,339,506","Methods and apparatus for secure registration to enable transactions between a first user and a vendor that is facilitated by a payment server are disclosed. The method may comprise storing a form soliciting customer information including a plurality of fields, wherein at least one of the plurality of fields is associated with an attribute. The method including receiving a copy of the form including customer data in all of the plurality of fields and transmitting a first subset of the customer data based on the attribute associated with the first subset of the customer data. The method including receiving a token in response to the transmission of the first subset of customer data and transmitting the token and a second subset of the customer data, wherein the second subset is based on the attribute associated with the second subset of customer data.",Wilmington,US,@PAY IP HOLDINGS LLC,"14/224,969",DE,"Wilmington, DE",SWOOP IP HOLDINGS LLC,1000004119356,"March 25, 2014","[['James', 'Kassemi', 'Albuquerque, NM'], ['Lawrence Glen', 'Holcomb', 'Albuquerque, NM']]","July 2, 2019",Method and system for a secure registration,http://patft.uspto.gov/netacgi/nph-Parser?Sect1=PTO2&Sect2=HITOFF&u=%2Fnetahtml%2FPTO%2Fsearch-adv.htm&r=9&p=1&f=G&l=50&d=PTXT&S1=paypal&OS=paypal&RS=paypal
"10,339,505","Provided is a method and a web-site integration system to integrate payment mechanisms into a commercial website that offers online merchants a flexible, user-friendly and customizable wizard to integrate payment mechanisms into their online commercial websites without having to understand the detailed intricacies of an API or other computer code. The wizard steps the merchant through creating an account to obtain credentials and educates the merchant on the page flows of the payment mechanism that the merchant wishes to integrate. Then, the wizard generates code snippets and files to be downloaded by the merchant and to be easily inserted into key pages of the merchant's online commercial website. The merchant can then test the completely integrated code in a developer's sandbox or go live with the completely integrated code.",CupertinoFremontMountain ViewAlvisoSan Jose,USUSUSUSUS,Pasupulati; Srinivasa RaoPatel; AmishGroleau; NickTaylor; William CharlesQadir; Saleem,"13/586,763",CACACACACA,"San Jose, CA","PAYPAL, INC.",1000004119355,"August 15, 2012","[['Srinivasa Rao', 'Pasupulati', 'Cupertino, CA'], ['Amish', 'Patel', 'Fremont, CA'], ['Nick', 'Groleau', 'Mountain View, CA'], ['William Charles', 'Taylor', 'Alviso, CA'], ['Saleem', 'Qadir', 'San Jose, CA']]","July 2, 2019",Payment mechanism integration wizard,http://patft.uspto.gov/netacgi/nph-Parser?Sect1=PTO2&Sect2=HITOFF&u=%2Fnetahtml%2FPTO%2Fsearch-adv.htm&r=10&p=1&f=G&l=50&d=PTXT&S1=paypal&OS=paypal&RS=paypal
"10,339,304","A computer-implemented method for generating tripwire files may include (1) generating an initial tripwire file according to an initial tripwire generation calculation, the initial tripwire file configured such that modification of the initial tripwire file triggers investigation of a security breach, (2) generating a subsequent tripwire file according to a subsequent tripwire generation calculation, the subsequent tripwire generation calculation differing from the initial tripwire generation calculation along at least one dimension, (3) receiving automated feedback that indicates whether at least one of the initial tripwire file and the subsequent tripwire file failed to enable detection of a security threat, and (4) adjusting automatic generation of a third tripwire file based on the automated feedback indicating whether at least one of the initial tripwire file and the subsequent tripwire file failed to detect the security threat. Various other methods, systems, and computer-readable media are also disclosed.",Mountain View,US,Symantec Corporation,"15/070,523",CA,"Mountain View, CA",Symantec Corporation,1000004119192,"March 15, 2016","[['Lei', 'Gu', 'Bedford, MA'], ['Ilya', 'Sokolov', 'Boston, MA'], ['Matt', 'Boucher', 'Merrimack, NH']]","July 2, 2019",Systems and methods for generating tripwire files,http://patft.uspto.gov/netacgi/nph-Parser?Sect1=PTO2&Sect2=HITOFF&u=%2Fnetahtml%2FPTO%2Fsearch-adv.htm&r=11&p=1&f=G&l=50&d=PTXT&S1=paypal&OS=paypal&RS=paypal
"10,339,103",A system and method for preventing hidden data being passed using steganography by performing additional steganography to obscure the hidden data such that the hidden data is unrecoverable without information regarding the method of the additional steganography. This system and method allows for preventing hidden data without having to decipher the hidden data.,San Jose,US,"PAYPAL, INC.","15/609,087",CA,"San Jose, CA","PAYPAL, INC.",1000004119024,"May 31, 2017","[['Shlomi', 'Boutnaru', 'Modiin, IL']]","July 2, 2019",Steganography obsfucation,http://patft.uspto.gov/netacgi/nph-Parser?Sect1=PTO2&Sect2=HITOFF&u=%2Fnetahtml%2FPTO%2Fsearch-adv.htm&r=12&p=1&f=G&l=50&d=PTXT&S1=paypal&OS=paypal&RS=paypal
"10,338,898",A system includes a user interface presented to a developer. The developer selects a first function to supplement functionality of a first application with external functionality available from third party applications. A code generation module provides a software object to the developer for incorporation into a first state of the first application. The first state includes a user interface element associated with an entity. User selection of the user interface element initiates preparation of a query wrapper including a combination of the entity's name and a predefined text string corresponding to the first function. The query wrapper is transmitted to a search system and a result set is received and displayed. A first item of the result set includes an access mechanism for a specified state of a target application. User selection of the first item causes the access mechanism to open the target application to the specified state.,"Suwon-si, Gyeonggi-do",KR,"Samsung Electronics Co., Ltd.","15/707,279",N/A,"Suwon-si, KR","Samsung Electronics Co., Ltd.",1000004118845,"September 18, 2017","[['Taher', 'Savliwala', 'Mountain View, CA'], ['Eric', 'Chen', 'Sunnyvale, CA'], ['Jonathan', 'Ben-Tzur', 'Sunnyvale, CA']]","July 2, 2019",State-specific external functionality for software developers,http://patft.uspto.gov/netacgi/nph-Parser?Sect1=PTO2&Sect2=HITOFF&u=%2Fnetahtml%2FPTO%2Fsearch-adv.htm&r=13&p=1&f=G&l=50&d=PTXT&S1=paypal&OS=paypal&RS=paypal
"10,338,691","Various methods and systems are provided to allow a user to perform finger gesture motions, such as making typing, swiping, tapping, or other types of finger motions to provide device input, such as typing, clicking, or selecting data into a webpage, application, operating system, or toolbar, that was normally performed by the user having to use a keyboard, mouse, stylus, microphone, touchscreen, or another input device.",San Jose,US,"PAYPAL, INC.","15/723,845",CA,"San Jose, CA","PayPal, Inc.",1000004118666,"October 3, 2017","[['Robert A.', 'Mason', 'Santa Monica, CA']]","July 2, 2019",Gesture identification,http://patft.uspto.gov/netacgi/nph-Parser?Sect1=PTO2&Sect2=HITOFF&u=%2Fnetahtml%2FPTO%2Fsearch-adv.htm&r=14&p=1&f=G&l=50&d=PTXT&S1=paypal&OS=paypal&RS=paypal
"10,335,593","Devices and methods are disclosed that treat a medical condition, such as migraine headache, by electrically stimulating a nerve noninvasively, which may be a vagus nerve situated within a patient's neck. Preferred embodiments allow a patient to self-treat his or her condition. Disclosed methods assure that the device is being positioned correctly on the neck and that the amplitude and other parameters of the stimulation actually stimulate the vagus nerve with a therapeutic waveform. Those methods comprise measuring properties of the patient's larynx, pupil diameters, blood flow within an eye, electrodermal activity and/or heart rate variability.",Basking Ridge,US,"ElectroCore, LLC","15/018,805",NJ,"Basking Ridge, NJ","Electrocore, Inc.",1000004115824,"February 8, 2016","[['Bruce J.', 'Simon', 'Mountain Lakes, NJ'], ['Joseph P.', 'Errico', 'Warren, NJ']]","July 2, 2019",Devices and methods for monitoring non-invasive vagus nerve stimulation,http://patft.uspto.gov/netacgi/nph-Parser?Sect1=PTO2&Sect2=HITOFF&u=%2Fnetahtml%2FPTO%2Fsearch-adv.htm&r=15&p=1&f=G&l=50&d=PTXT&S1=paypal&OS=paypal&RS=paypal
"10,334,396","Various implementations monitor a parent geofence that geographically encompasses a plurality of child geofences, each respective child geofence of the child geofences associated with a respective physical location within the parent geofence. One or more implementations receive location data that indicates a current location of a mobile device. In turn, the current location can be used to determine that the mobile device has entered a particular child geofence of the plurality of child geofences. In response to determining that the mobile device has entered the particular child geofence, one or more implementations select an application configuration for a mobile application on the mobile device, where the application configuration corresponds to the particular child geofence. One or more implementations transmit the application configuration to the mobile device effective to alter a functionality of the mobile application at the mobile device based on the current location.",San Jose,US,eBay Inc.,"16/138,585",CA,"San Jose, CA",eBay Inc.,1000004108287,"September 21, 2018","[['Nate L', 'Lyman', 'Livermore, CA'], ['Frank', 'Russo', 'Sunnyvale, CA']]","June 25, 2019",Configuring mobile device applications based on location,http://patft.uspto.gov/netacgi/nph-Parser?Sect1=PTO2&Sect2=HITOFF&u=%2Fnetahtml%2FPTO%2Fsearch-adv.htm&r=16&p=1&f=G&l=50&d=PTXT&S1=paypal&OS=paypal&RS=paypal
"10,334,050","Various embodiments relate generally to autonomous vehicles and associated mechanical, electrical and electronic hardware, computer software and systems, and wired and wireless network communications to provide an autonomous vehicle fleet as a service. In particular, a method may include identifying a location of a user device associated with a user, transmitting a command to an autonomous vehicle system associated with an autonomous vehicle service to transit to the location, and providing information associated with the user device to the autonomous vehicle system, where the information includes configuration data to adapt one or more sub-systems of the autonomous vehicle. Sub-systems of the autonomous vehicle may include interior lighting, ambient sound, road handling, seating configuration, communication synchronization, and temperature control systems.",Menlo Park,US,"Zoox, Inc.","14/933,665",CA,"Foster City, CA","Zoox, Inc.",1000004107972,"November 5, 2015","[['Timothy David', 'Kentley-Klay', 'Stanford, CA'], ['Rachad Youssef', 'Gamara', 'San Francisco, CA']]","June 25, 2019",Software application and logic to modify configuration of an autonomous vehicle,http://patft.uspto.gov/netacgi/nph-Parser?Sect1=PTO2&Sect2=HITOFF&u=%2Fnetahtml%2FPTO%2Fsearch-adv.htm&r=17&p=1&f=G&l=50&d=PTXT&S1=paypal&OS=paypal&RS=paypal
"10,332,344",The present disclosure relates generally to a system that utilizes a lighted bezel of a player tracking unit to indicate to a player different wireless connection statuses of a mobile device.,Las Vegas,US,IGT,"15/657,762",NV,"Las Vegas, NV",IGT,1000004106453,"July 24, 2017","[['Erik B.', 'Petersen', 'Reno, NV'], ['Kevin', 'Higgins', 'Reno, NV']]","June 25, 2019",System and method for controlling electronic gaming machine/electronic gaming machine component bezel lighting to indicate different wireless connection statuses,http://patft.uspto.gov/netacgi/nph-Parser?Sect1=PTO2&Sect2=HITOFF&u=%2Fnetahtml%2FPTO%2Fsearch-adv.htm&r=18&p=1&f=G&l=50&d=PTXT&S1=paypal&OS=paypal&RS=paypal
"10,332,214","The present application describes a system of managing electronic receipts including a point-of-sale system, a unique identifier detection mechanism, and a server. The point-of-sale system is configured to register a plurality of goods and/or services, comprising a transaction receipt. The unique identifier detection mechanism detects a first unique identifier and a second unique identifier. The server is in communication with the point-of-sale system and includes a processor configured to register the payment of the transaction receipt as a function of the first unique identifier and a memory device is configured to store a database with a plurality of receipt-data storage locations. In response to the approval the payment, the point-of-sale system forwards the second unique identifier and the transaction receipt to the server and stores the transaction receipt within the receipt-data storage location associated with the second unique identifier.",Tulsa,US,Freeman; Michael H.,"14/790,422",OK,,,1000004106344,"July 2, 2015","[['Michael H.', 'Freeman', 'Tulsa, OK']]","June 25, 2019","Receiving, sending and managing electronic approvals and receipt invention",http://patft.uspto.gov/netacgi/nph-Parser?Sect1=PTO2&Sect2=HITOFF&u=%2Fnetahtml%2FPTO%2Fsearch-adv.htm&r=19&p=1&f=G&l=50&d=PTXT&S1=paypal&OS=paypal&RS=paypal
"10,332,202","An on-line savings page for managing a savings account includes a list of items the user is saving for, where each item has a specified priority. A savings rate for each item is determined by the savings account based on the priority and total savings rate. The user is notified of any changes in the savings account, such as price changes, inventory changes, etc., as well as relevant information related to the item, such as sales, offers, recalls, etc.",San Jose,US,"PAYPAL, INC.","15/824,891",CA,"San Jose, CA","PAYPAL, INC.",1000004106337,"November 28, 2017","[['Michael', 'Watson', 'Lincoln, NE']]","June 25, 2019",On-line savings account,http://patft.uspto.gov/netacgi/nph-Parser?Sect1=PTO2&Sect2=HITOFF&u=%2Fnetahtml%2FPTO%2Fsearch-adv.htm&r=20&p=1&f=G&l=50&d=PTXT&S1=paypal&OS=paypal&RS=paypal
