patent_num,abstract,applicant_city,applicant_country,applicant_name,applicant_num,applicant_state,assignee_loc,assignee_name,family_id,file_date,inventors,patent_date,title,url
"10,341,363","According to one embodiment, an apparatus comprises a processor and memory. Communicatively coupled to the processor, the memory includes a detection module that, when executed, conducts an analysis of a received object to determine if the received object is associated with a malicious attack. The detection module is configurable, and thus, certain capabilities can be enabled, disabled or modified. The analysis is to be altered upon receipt of a configuration file that includes information to alter one or more rules controlling the analysis conducted by the detection module.",Milpitas,US,"FireEye, Inc.","14/981,765",CA,"Milpitas, CA","FireEye, Inc.",1000001682282,"December 28, 2015","[['Michael', 'Vincent', 'Sunnyvale, CA'], ['Emmanuel', 'Thioux', 'Santa Cruz, CA'], ['Sai', 'Vashisht', 'Union City, CA'], ['Darien', 'Kindlund', 'Great Falls, VA']]","July 2, 2019",Dynamically remote tuning of a malware content detection system,http://patft.uspto.gov/netacgi/nph-Parser?Sect1=PTO2&Sect2=HITOFF&u=%2Fnetahtml%2FPTO%2Fsearch-adv.htm&r=62&f=G&l=50&d=PTXT&s1=microsoft&p=2&OS=microsoft&RS=microsoft
"10,341,354","A high availability (HA) Identity Bridge (IDBridge) between an on-premises Active Directory (AD) and a cloud-based Identity Cloud Service (IDCS) is provided. A connection to an AD, coupled to a first network, is established. A connection to an IDCS, coupled to a second network, is established, the IDCS including a System for Cross-domain Identity Management (SCIM) directory. A plurality of selectable AD OUs are displayed in a GUI, and a selection of one or more OUs is then received. Each member group of the selected OUs is displayed in the GUI, and a selection of one or more member groups of the selected OUs is then received. The users of the selected OUs and the selected member groups of the selected OUs are monitored to identify users and groups that have been added, modified or deleted. The identified users and groups are then synchronized to the SCIM directory.",Redwood Shores,US,Oracle International Corporation,"15/705,590",CA,"Redwood Shores, CA",Oracle International Corporation,1000004120983,"September 15, 2017","[['Anand', 'Murugesan', 'Fremont, CA'], ['Vadim', 'Lander', 'Newton, MA'], ['Loganathan', 'Ramasamy', 'Bangalore, IN'], ['Sudarsan', 'Sridhar', 'Maharashtra, IN']]","July 2, 2019",Distributed high availability agent architecture,http://patft.uspto.gov/netacgi/nph-Parser?Sect1=PTO2&Sect2=HITOFF&u=%2Fnetahtml%2FPTO%2Fsearch-adv.htm&r=63&f=G&l=50&d=PTXT&s1=microsoft&p=2&OS=microsoft&RS=microsoft
"10,341,350","Disclosed embodiments include identifying a first identity having a first level of privileged network access, identifying a network resource that the first identity is communicating with, classifying the network resource as a network resource to be dynamically monitored, dynamically monitoring connections activity of the identified network resource to determine a second identity, wherein the second identity is determined based on it having a second level of privileged network access that is different from the first level of privileged network access and having attempted to establish a connection with the network resource, classifying, based on the determination of the second identity, the network resource as a potential source of privileged access escalation vulnerabilities, and performing, based on the classification that the network resource is a potential source of privileged access escalation vulnerabilities, at least one of: triggering an alert regarding the potential source of privileged access escalation vulnerabilities, performing a network security remediation operation for at least one of the first identity, the second identity, and the network resource, and identifying a plurality of other identities with levels of privileged network access different from the first level of privileged network access and that have attempted to establish connections with the network resource.",Petach-Tikva,IL,CyberArk Software Ltd.,"15/948,940",N/A,"Petach-Tikva, IL",CYBERARK SOFTWARE LTD.,1000004120980,"April 9, 2018","[['Lavi', 'Lazarovitz', 'Petach-Tikva, IL'], ['Asaf', 'Hecht', 'Petach-Tikva, IL']]","July 2, 2019",Actively identifying and neutralizing network hot spots,http://patft.uspto.gov/netacgi/nph-Parser?Sect1=PTO2&Sect2=HITOFF&u=%2Fnetahtml%2FPTO%2Fsearch-adv.htm&r=64&f=G&l=50&d=PTXT&s1=microsoft&p=2&OS=microsoft&RS=microsoft
"10,341,323","A domain name registrar may suggest and/or allow a user to select one or more domain names registered to the user for on demand multifactor authentication. The user may select one or more protected activities that trigger the enhanced security for the selected domain name(s). The user may also enter a plurality of authenticatees, contact information for the authenticatees and a minimum number of authenticatees required to approve the one or more protected activities. The user and/or authenticatees may also enter at least two authentication methods for each authenticatee and corresponding correct responses. The selected domain names are thus protected from the protected activities until approved by a minimum number of authenticatees using at least a first authentication method and a second authentication method selected from different groups of ""what you know,"" what you have"" and ""what you are"" authentication methods.",Scottsdale,US,"Go Daddy Operating Company, LLC","15/610,460",AZ,"Scottsdale, AZ","GO DADDY OPERATING COMPANY, LLC",1000002695039,"May 31, 2017","[['Arnold Neil', 'Blinn', 'Hunts Point, WA']]","July 2, 2019",Automated method for on demand multifactor authentication,http://patft.uspto.gov/netacgi/nph-Parser?Sect1=PTO2&Sect2=HITOFF&u=%2Fnetahtml%2FPTO%2Fsearch-adv.htm&r=65&f=G&l=50&d=PTXT&s1=microsoft&p=2&OS=microsoft&RS=microsoft
"10,341,322","A domain name registrar may suggest and/or allow a user to select one or more domain names registered to the user for on demand multifactor authentication. The user may select one or more protected activities that trigger the enhanced security for the selected domain name(s). The user may also enter a plurality of authenticatees, contact information for the authenticatees and a minimum number of authenticatees required to approve the one or more protected activities. The user and/or authenticatees may also enter at least two authentication methods for each authenticatee and corresponding correct responses. The selected domain names are thus protected from the protected activities until approved by a minimum number of authenticatees using at least a first authentication method and a second authentication method selected from different groups of ""what you know,"" what you have"" and ""what you are"" authentication methods.",Scottsdale,US,"Go Daddy Operating Company, LLC","15/610,455",AZ,"Scottsdale, AZ","GO DADDY OPERATING COMPANY, LLC",1000002691399,"May 31, 2017","[['Arnold Neil', 'Blinn', 'Hunts Point, WA']]","July 2, 2019",On demand multifactor authentication,http://patft.uspto.gov/netacgi/nph-Parser?Sect1=PTO2&Sect2=HITOFF&u=%2Fnetahtml%2FPTO%2Fsearch-adv.htm&r=66&f=G&l=50&d=PTXT&s1=microsoft&p=2&OS=microsoft&RS=microsoft
"10,341,321","A method provides policy based adaptive application capability management and device attestation for dynamic control of remote device operations. The method includes instrumenting applications installed on a remote device to examine their runtime application programming interface (API) invocations to trusted functions abstracted by a trusted services platform anchored to an underlying firmware, software or hardware root of trust, and managing the application security operations based on the execution context and dynamic privilege controls to restrict their capabilities. The invention also provides a local attestation agent to perform state measurements for platform trust, configuration and operational metrics, and generates device policy based platform and application level alerts. These alerts allow operations technology (OT) administrators to dynamically control the operational capabilities of applications, to deal with discovered vulnerabilities and exploits, before requiring distribution of application software upgrades or patches onto a large number of distributed remote devices.",San Francisco,US,Mocana Corporation,"15/390,874",CA,"Sunnyvale, CA",MOCANA CORPORATION,1000004120956,"December 27, 2016","[['Srinivas', 'Kumar', 'Cupertino, CA'], ['Celena', 'Tanguay', 'Oakland, CA'], ['Steven Darrel', 'Burnett', 'Millbrae, CA']]","July 2, 2019",System and method for policy based adaptive application capability management and device attestation,http://patft.uspto.gov/netacgi/nph-Parser?Sect1=PTO2&Sect2=HITOFF&u=%2Fnetahtml%2FPTO%2Fsearch-adv.htm&r=67&f=G&l=50&d=PTXT&s1=microsoft&p=2&OS=microsoft&RS=microsoft
"10,341,320",An identity platform system configured to authenticate a company-assigned device for accessing a first network using a first unique pre-shared key associated with the company-assigned device. A personal BYOD credential management system configured to authenticate a personal BYOD for accessing a second network using a second unique pre-shared key associated with the personal BYOD. A network administrator interface configured to provide access to the identity platform for a network administrator. A personal BYOD credential management system API included as part of the identity platform system and configured to provide the identity platform system access to the personal BYOD credential management system as if the personal BYOD credential management system is embedded in the identity platform system.,Milpitas,US,"Aerohive Networks, Inc.","15/053,298",CA,"Milpitas, CA","Aerohive Networks, Inc.",1000004120955,"February 25, 2016","[['John William', 'Hanay', 'Palo Alto, CA'], ['Michael Isamu', 'Lee', 'San Jose, CA'], ['Ngan My Bich', 'Huynh', 'Campbell, CA']]","July 2, 2019",BYOD credential management,http://patft.uspto.gov/netacgi/nph-Parser?Sect1=PTO2&Sect2=HITOFF&u=%2Fnetahtml%2FPTO%2Fsearch-adv.htm&r=68&f=G&l=50&d=PTXT&s1=microsoft&p=2&OS=microsoft&RS=microsoft
"10,341,317",Techniques for making personalized provider recommendations in related categories include identifying a first entity category from a plurality of entity categories based on context information. A first category relationship is identified from a plurality of category relationships based on the first entity category. The first category relationship indicates that the first entity category and a second entity category are related. A first provider specific profile is identified from a plurality of provider specific profiles based on user profile data associated with a user account. The first provider specific profile is associated with the first entity category. A second provider specific profile associated with the second entity category is identified from the plurality of provider specific profiles based on the user profile data. A plurality of providers including a first provider associated with the first provider specific profile and a second provider associated with the second provider specific profile is displayed.,Tucker,US,YP LLC,"14/918,340",GA,"D/FW Airport, TX",YP LLC,1000004120952,"October 20, 2015","[['Sudheer', 'Sahu', 'Encinitas, CA'], ['Randell', 'Beltran', 'Arcadia, CA'], ['Monik', 'Khare', 'Pasadena, CA'], ['Premkumar', 'Mani', 'Santa Clarita, CA'], ['Gunjan', 'Sharman', 'Los Angeles, CA'], ['Saravana Narayana', 'Reddy Siddhavarapu', 'Glendale, CA'], ['Nataliya', 'Kupchyk', 'Sherman Oaks, CA']]","July 2, 2019",Systems and methods for implementing a personalized provider recommendation engine,http://patft.uspto.gov/netacgi/nph-Parser?Sect1=PTO2&Sect2=HITOFF&u=%2Fnetahtml%2FPTO%2Fsearch-adv.htm&r=69&f=G&l=50&d=PTXT&s1=microsoft&p=2&OS=microsoft&RS=microsoft
"10,341,307","An application is instrumented with a document protection service provider interface (SPI). The interface is used to call an external function, e.g., an encryption utility, to facilitate secure document exchange between a sending entity and a receiving entity. When the application invokes the SPI, the user is provided with a display panel. The end user provides a password for encryption key generation, together with an indication of desired encryption strength. The service provider uses the password to generate an encryption key. In one embodiment, the service provider provides the key to the service provider interface, which then uses the key to encrypt the document and to complete the file transfer operation. In the alternative, the service provider itself performs encryption. The SPI generates and sends a message to the receiving entity that includes the key or a link to enable the receiving entity to retrieve the key.",Armonk,US,International Business Machines Corporation,"15/803,796",NY,"Armonk, NY",International Business Machines Corporation,1000004120944,"November 5, 2017","[['Heather Maria', 'Hinton', 'Austin, TX'], ['Ivan Matthew', 'Milman', 'Austin, TX']]","July 2, 2019",Method and system for secure document exchange,http://patft.uspto.gov/netacgi/nph-Parser?Sect1=PTO2&Sect2=HITOFF&u=%2Fnetahtml%2FPTO%2Fsearch-adv.htm&r=70&f=G&l=50&d=PTXT&s1=microsoft&p=2&OS=microsoft&RS=microsoft
"10,341,302","A method for establishing a secure communication session over communication paths between one or more client devices and one or more server computers according to a communication protocol includes initiating the session including passing communication through a proxy on a device on the communication paths, passing session initiation information between the client devices and the server computers via the proxy, passing encrypted content between the client devices and the server computers over secure communication sessions, each established for exclusive access from one client device and one server computer based on the exchanged session initiation information between said client device and said server computer whereby the proxy does not have access to the content, and modifying, using the proxy, at least some information passing between a client device and a server computer such that the communication to and from the server computer adheres to the communication protocol.",ArlingtonWaban,USUS,Khazan; Roger I.Utin; Daniil M.,"15/148,327",MAMA,"Cambridge, MA",Massachusetts Institute of Technology,1000004120940,"May 6, 2016","[['Roger I.', 'Khazan', 'Arlington, MA'], ['Daniil M.', 'Utin', 'Waban, MA']]","July 2, 2019",Optimized transport layer security,http://patft.uspto.gov/netacgi/nph-Parser?Sect1=PTO2&Sect2=HITOFF&u=%2Fnetahtml%2FPTO%2Fsearch-adv.htm&r=71&f=G&l=50&d=PTXT&s1=microsoft&p=2&OS=microsoft&RS=microsoft
"10,341,289","Organizing a participant list includes maintaining a participant list of users of an electronic communications system to be used by a first user of the electronic communications system. Communications strengths between the first user and each of the users included in the participant list are determined. The users included in the participant list are organized based on the corresponding communications strengths. Communications strengths may be determined for users included in a group within a participant list, and the users within the group may be organized within the group based on communications strength. An additional group in the participant list in which some or all of the users included in the participant list are organized based on communications strength may be provided.",McLeanGreat Falls,USUS,Appelman; BarryFish; Edmund J.,"13/618,707",VAVA,"Menlo Park, CA","FACEBOOK, INC.",1000004120928,"September 14, 2012","[['Barry', 'Appelman', 'McLean, VA'], ['Edmund J.', 'Fish', 'Great Falls, VA']]","July 2, 2019",Systems and methods of calculating communications strengths,http://patft.uspto.gov/netacgi/nph-Parser?Sect1=PTO2&Sect2=HITOFF&u=%2Fnetahtml%2FPTO%2Fsearch-adv.htm&r=72&f=G&l=50&d=PTXT&s1=microsoft&p=2&OS=microsoft&RS=microsoft
"10,341,285","Systems, methods and devices for distributed memory management comprising a network component configured for network communication with one or more memory resources that store data and one or more consumer devices that use data, the network component comprising a switching device in operative communication with a mapping resource, wherein the mapping resource is configured to associate mappings between data addresses associated with memory requests from a consumer device relating to a data object and information relating to a storage location in the one or more memory resources associated with the data from the data object, wherein each data address has contained therein identification information for identifying the data from the data object associated with that data address; and the switching device is configured to route memory requests based on the mappings.",Durham,US,OPEN INVENTION NETWORK LLC,"15/205,374",NC,"Durham, NC",OPEN INVENTION NETWORK LLC,1000004120924,"July 8, 2016","[['Andrew', 'Warfield', 'Vancouver, CA'], ['Jacob Taylor', 'Wires', 'Vancouver, CA'], ['Daniel', 'Stodden', 'Vancouver, CA'], ['Dutch', 'Meyer', 'Bellingham, WA'], ['Jean Maurice Guy', 'Guyader', 'Vancouver, CA'], ['Keir', 'Fraser', 'Cambridge, GB'], ['Timothy John', 'Deegan', 'Cambridge, GB'], ['Brendan Anthony', 'Cully', 'Vancouver, CA'], ['Christopher', 'Clark', 'Tigard, OR'], ['Kevin', 'Jamieson', 'Vancouver, CA'], ['Geoffrey', 'Lefebvre', 'Montreal, CA']]","July 2, 2019","Systems, methods and devices for integrating end-host and network resources in distributed memory",http://patft.uspto.gov/netacgi/nph-Parser?Sect1=PTO2&Sect2=HITOFF&u=%2Fnetahtml%2FPTO%2Fsearch-adv.htm&r=73&f=G&l=50&d=PTXT&s1=microsoft&p=2&OS=microsoft&RS=microsoft
"10,341,283","Systems, methods, and non-transitory computer-readable media can acquire a video resource at a first level of a tiered architecture. A first video representation can be generated, based on the video resource, at a second level of the tiered architecture. The first video representation can be associated with a first publisher. It can be detected that at least a first post and a second post are utilizing the first video representation. The first post and the second post can be representable at a third level of the tiered architecture and can be initiated by the first publisher. Data analytics for the first video representation can be aggregated based on the first post and the second post.",Menlo Park,US,"Facebook, Inc.","15/076,534",CA,"Menlo Park, CA","Facebook, Inc.",1000004120922,"March 21, 2016","[['Lior Ben', 'Kereth', 'San Francisco, CA'], ['Anaid Gomez', 'Ortigoza Petit Jean', 'San Francisco, CA'], ['Rujin', 'Cao', 'Fremont, CA'], ['Christine Farahat Sedky Abouelkhel', 'Awad', 'Mountain View, CA'], ['Mathumathi', 'Velusamy', 'Fremont, CA']]","July 2, 2019",Systems and methods for providing data analytics for videos based on a tiered architecture,http://patft.uspto.gov/netacgi/nph-Parser?Sect1=PTO2&Sect2=HITOFF&u=%2Fnetahtml%2FPTO%2Fsearch-adv.htm&r=74&f=G&l=50&d=PTXT&s1=microsoft&p=2&OS=microsoft&RS=microsoft
"10,341,276","Systems, methods, and non-transitory computer-readable media can transmit at least a media content item to a recipient device. A response can be received from the recipient device. At least the media content item can be obscured to produce an obscured media content item. The response and the obscured media content item can be presented. The response can overlay the obscured media content item.",Menlo Park,US,"Facebook, Inc.","14/567,707",CA,"Menlo Park, CA","Facebook, Inc.",1000004120915,"December 11, 2014","[['Samantha P.', 'Krug', 'Menlo Park, CA'], ['Ian Mc Intyre', 'Silber', 'San Jose, CA'], ['Christopher', 'Cunningham', 'Sunnyvale, CA'], ['Ryan Jacob', 'Gomba', 'San Francisco, CA']]","July 2, 2019",Systems and methods for providing communications with obscured media content backgrounds,http://patft.uspto.gov/netacgi/nph-Parser?Sect1=PTO2&Sect2=HITOFF&u=%2Fnetahtml%2FPTO%2Fsearch-adv.htm&r=75&f=G&l=50&d=PTXT&s1=microsoft&p=2&OS=microsoft&RS=microsoft
"10,341,269","Threaded conversation channel with a temporarily exclusive conversation. One embodiment includes a data processing system implementing a threaded conversation channel. The data processing system includes a network interface coupled to a network. The data processing system also includes a memory for storing instructions and an electronic processor coupled to the network interface and the memory. The electronic processor is configured to execute the instructions to generate the threaded conversation channel and to receive conversation parameters including a recipient, a delivery time, and initial message content. The electronic processor is also configured to post a temporarily exclusive conversation based on the conversation parameters that is hidden from at least a first user of the temporarily exclusive conversation and viewable by at least a second user. The electronic processor is also configured to reveal, to the first user at the delivery time, the temporarily exclusive conversation on the threaded conversation channel.",Redmond,US,"Microsoft Technology Licensing, LLC","15/357,820",WA,"Redmond, WA","Microsoft Technology Licensing, LLC",1000004120908,"November 21, 2016","[['Yingying', 'Geng', 'Seattle, WA'], ['Chad A.', 'Voss', 'Seattle, WA'], ['Vivian', 'Hsu', 'Seattle, WA']]","July 2, 2019",Threaded conversation channel with a temporarily exclusive conversation,http://patft.uspto.gov/netacgi/nph-Parser?Sect1=PTO2&Sect2=HITOFF&u=%2Fnetahtml%2FPTO%2Fsearch-adv.htm&r=76&f=G&l=50&d=PTXT&s1=microsoft&p=2&OS=microsoft&RS=microsoft
"10,341,268","Disclosed are a method and device for implementing instant messaging through a browser. A plug-in interface of an instant messaging tool is preset on the browser. The method comprises: a master process of the browser creating a plug-in process corresponding to the instant messaging tool; triggering the plug-in interface to instruct the master process of the browser to reload a browser window; the master process of the browser dividing, in the browser window, page presentation ranges of a plug-in page of the instant messaging tool and a current tab of the browser window and notifying the plug-in process of the page presentation ranges; and the plug-in process generating the plug-in page according to the divided page presentation ranges and loading the plug-in page and the re-rendered current tab side by side in the browser window.",Beijing,CN,BEIJING QIHOO TECHNOLOGY COMPANY LIMITED,"15/038,438",N/A,"Beijing, CN",BEIJING QIHOO TECHNOLOGY COMPANY LIMITED,1000004120907,"November 19, 2014","[['Tao', 'Zou', 'Beijing, CN']]","July 2, 2019",Method and device for implementing instant messaging,http://patft.uspto.gov/netacgi/nph-Parser?Sect1=PTO2&Sect2=HITOFF&u=%2Fnetahtml%2FPTO%2Fsearch-adv.htm&r=77&f=G&l=50&d=PTXT&s1=microsoft&p=2&OS=microsoft&RS=microsoft
"10,341,267","A computer system comprises computer storage holding a plurality of code modules, one or more processors and a communication system. The one or more processors are configured to execute the code modules and thereby implement the bots. The communication system comprises a message relay and an anonymized identifier generator. The message relay is configured to receive a message comprising an identifier of a user and an identifier of a target one of the bots. The anonymized identifier generator is configured to generate an anonymized identifier of the user unique to the target bot, by applying an anonymization function to the user identifier and the bot identifier in the message. The message relay is configured to transmit to the target bot a version of the message, which comprises the anonymized user identifier and does not include the user identifier, wherein the user identifier is not rendered accessible to the target bot.",Redmond,US,"Microsoft Technology Licensing, LLC","15/187,215",WA,"Redmond, WA","Microsoft Technology Licensing, LLC",1000004120906,"June 20, 2016","[['Farookh', 'Mohammed', 'Redmond, WA'], ['Krishnan', 'Ananthanarayanan', 'Redmond, WA'], ['Alexey', 'Pikin', 'Moscow, RU'], ['Mieszko G.', 'Matkowski', 'Woodinville, WA'], ['Andrey', 'Belenko', 'Prague, CZ']]","July 2, 2019",Anonymized identifiers for secure communication systems,http://patft.uspto.gov/netacgi/nph-Parser?Sect1=PTO2&Sect2=HITOFF&u=%2Fnetahtml%2FPTO%2Fsearch-adv.htm&r=78&f=G&l=50&d=PTXT&s1=microsoft&p=2&OS=microsoft&RS=microsoft
